{
  "$schema": "https://json-schema.org/draft/2020-12/schema",
  "$id": "https://github.com/num1hub/capsule-specs/schemas/public-audience-paths.schema.json",
  "title": "Public Audience Paths",
  "type": "object",
  "additionalProperties": false,
  "required": [
    "version",
    "reviewed_at",
    "purpose",
    "audiences",
    "review_commands"
  ],
  "properties": {
    "version": {
      "type": "string",
      "minLength": 1
    },
    "reviewed_at": {
      "type": "string",
      "minLength": 1
    },
    "purpose": {
      "type": "string",
      "minLength": 1
    },
    "audiences": {
      "type": "array",
      "minItems": 1,
      "items": {
        "type": "object",
        "additionalProperties": false,
        "required": [
          "id",
          "summary",
          "starting_points",
          "strongest_surfaces",
          "verify_commands",
          "completion_signals",
          "bounded_non_goals"
        ],
        "properties": {
          "id": {
            "type": "string",
            "minLength": 1
          },
          "summary": {
            "type": "string",
            "minLength": 1
          },
          "starting_points": {
            "type": "array",
            "minItems": 1,
            "items": {
              "type": "string",
              "minLength": 1
            }
          },
          "strongest_surfaces": {
            "type": "array",
            "minItems": 1,
            "items": {
              "type": "string",
              "minLength": 1
            }
          },
          "verify_commands": {
            "type": "array",
            "minItems": 1,
            "items": {
              "type": "string",
              "minLength": 1
            }
          },
          "completion_signals": {
            "type": "array",
            "minItems": 1,
            "items": {
              "type": "string",
              "minLength": 1
            }
          },
          "bounded_non_goals": {
            "type": "array",
            "minItems": 1,
            "items": {
              "type": "string",
              "minLength": 1
            }
          }
        }
      }
    },
    "review_commands": {
      "type": "array",
      "minItems": 1,
      "items": {
        "type": "string",
        "minLength": 1
      }
    }
  }
}
